{
  "schemaVersion": 1,
  "normalizationVersion": 1,
  "generatedBy": "pnpm data:create-awesome:refresh",
  "notice": "DO NOT EDIT MANUALLY",
  "families": [
    {
      "id": "node",
      "adapter": "typed-intersection",
      "templates": [
        {
          "id": "nestjs-boilerplate",
          "sourceId": "nestjs-boilerplate",
          "sourceOrder": 0,
          "name": "NestJS Boilerplate",
          "description": "Modular NestJS API with TypeScript, ESLint, and Prettier. Reach for it when you want controllers, providers, and clear module boundaries from day one.",
          "sourceUrl": "https://github.com/Create-Node-App/cna-templates/tree/main/templates/nestjs-starter",
          "category": "backend-applications",
          "labels": [
            "NestJS",
            "Backend",
            "TypeScript",
            "ESLint",
            "Prettier",
            "Scalable",
            "Maintainable"
          ],
          "typeIds": [
            "nestjs-backend"
          ]
        },
        {
          "id": "nextjs-starter",
          "sourceId": "nextjs-starter",
          "sourceOrder": 1,
          "name": "NextJS Starter",
          "description": "Next.js App Router starter with TypeScript and a feature-based layout. Use it for full-stack React apps that need server components, routes, and optional auth examples.",
          "sourceUrl": "https://github.com/Create-Node-App/cna-templates/tree/main/templates/nextjs-starter",
          "category": "fullstack-applications",
          "labels": [
            "Next.js",
            "FullStack",
            "TypeScript",
            "ESLint",
            "Prettier",
            "Customizable",
            "App Router"
          ],
          "typeIds": [
            "nextjs"
          ]
        },
        {
          "id": "turborepo-boilerplate",
          "sourceId": "turborepo-boilerplate",
          "sourceOrder": 2,
          "name": "Turborepo Boilerplate",
          "description": "Turborepo workspace with TypeScript, Changesets, and shared packages. Best when multiple apps share UI or config and you want pipeline caching.",
          "sourceUrl": "https://github.com/Create-Node-App/cna-templates/tree/main/templates/turborepo-starter",
          "category": "monorepo-boilerplate",
          "labels": [
            "Monorepo",
            "Turborepo",
            "TypeScript",
            "Changesets",
            "Workspaces",
            "Efficient",
            "Multi-package"
          ],
          "typeIds": [
            "monorepo"
          ]
        },
        {
          "id": "react-vite-boilerplate",
          "sourceId": "react-vite-boilerplate",
          "sourceOrder": 3,
          "name": "React Vite Boilerplate",
          "description": "React SPA on Vite with React Router and TypeScript. Choose it for client-only apps where instant HMR and a lean build matter more than SSR.",
          "sourceUrl": "https://github.com/Create-Node-App/cna-templates/tree/main/templates/react-vite-starter",
          "category": "frontend-applications",
          "labels": [
            "React",
            "Vite",
            "Frontend",
            "TypeScript",
            "ESLint",
            "Prettier",
            "React Router",
            "SPA",
            "HMR"
          ],
          "typeIds": [
            "react"
          ]
        },
        {
          "id": "web-extension-react-boilerplate",
          "sourceId": "web-extension-react-boilerplate",
          "sourceOrder": 4,
          "name": "Web Extension React Boilerplate",
          "description": "React + Vite WebExtension with HMR and polyfills. Use it for Chrome/Firefox/Edge extensions that share a React UI across popup and pages.",
          "sourceUrl": "https://github.com/Create-Node-App/cna-templates/tree/main/templates/webextension-react-vite-starter",
          "category": "web-extension",
          "labels": [
            "WebExtension",
            "React",
            "Vite",
            "TypeScript",
            "Hot Reload",
            "Polyfill",
            "ESLint",
            "Prettier"
          ],
          "typeIds": [
            "webextension-react"
          ]
        },
        {
          "id": "webdriverio-boilerplate",
          "sourceId": "webdriverio-boilerplate",
          "sourceOrder": 5,
          "name": "WebdriverIO Boilerplate",
          "description": "WebdriverIO + TypeScript harness with Selenoid-friendly setup. Scaffold this when the project is an acceptance-test suite, not the app under test.",
          "sourceUrl": "https://github.com/Create-Node-App/cna-templates/tree/main/templates/wdio-starter",
          "category": "user-acceptance-testing",
          "labels": [
            "WebdriverIO",
            "Testing",
            "TypeScript",
            "Selenoid",
            "ESLint",
            "Prettier",
            "Automated Testing"
          ],
          "typeIds": [
            "webdriverio"
          ]
        },
        {
          "id": "nextjs-saas-ai-starter",
          "sourceId": "nextjs-saas-ai-starter",
          "sourceOrder": 6,
          "name": "NextJS SaaS AI Starter",
          "description": "Multi-tenant Next.js SaaS with AI providers, Auth.js v5, Drizzle + PostgreSQL, Tailwind v4, shadcn/ui, RBAC, audit logs, webhooks, and i18n. The flagship product showcase — not a minimal starter.",
          "sourceUrl": "https://github.com/Create-Node-App/cna-templates/tree/main/templates/nextjs-saas-ai-starter",
          "category": "fullstack-applications",
          "labels": [
            "Next.js",
            "SaaS",
            "AI",
            "Multi-tenant",
            "TypeScript",
            "Tailwind CSS",
            "shadcn/ui",
            "Drizzle",
            "PostgreSQL",
            "Auth.js",
            "RBAC",
            "i18n"
          ],
          "typeIds": [
            "nextjs-saas-ai"
          ]
        },
        {
          "id": "remix-starter",
          "sourceId": "remix-starter",
          "sourceOrder": 7,
          "name": "Remix / React Router v7 Starter",
          "description": "React Router v7 with file-based routes, loaders/actions, and TypeScript. Pick it when you want SSR and nested data routes without the Next.js App Router model.",
          "sourceUrl": "https://github.com/Create-Node-App/cna-templates/tree/main/templates/remix-starter",
          "category": "fullstack-applications",
          "labels": [
            "Remix",
            "React Router",
            "FullStack",
            "TypeScript",
            "SSR",
            "File-based Routing"
          ],
          "typeIds": [
            "remix"
          ]
        },
        {
          "id": "astro-starter",
          "sourceId": "astro-starter",
          "sourceOrder": 8,
          "name": "Astro Starter",
          "description": "Astro static site with TypeScript and island-friendly structure. Ideal for docs, marketing, and content sites that ship HTML first and hydrate only where needed.",
          "sourceUrl": "https://github.com/Create-Node-App/cna-templates/tree/main/templates/astro-starter",
          "category": "frontend-applications",
          "labels": [
            "Astro",
            "Static Site",
            "TypeScript",
            "Frontend",
            "Content"
          ],
          "typeIds": [
            "astro"
          ]
        },
        {
          "id": "hono-starter",
          "sourceId": "hono-starter",
          "sourceOrder": 9,
          "name": "Hono Starter",
          "description": "Minimal Hono API in TypeScript. Use it for edge, serverless, or small HTTP services where NestJS would be heavier than you need.",
          "sourceUrl": "https://github.com/Create-Node-App/cna-templates/tree/main/templates/hono-starter",
          "category": "backend-applications",
          "labels": [
            "Hono",
            "API",
            "Backend",
            "TypeScript",
            "Serverless",
            "Edge"
          ],
          "typeIds": [
            "hono"
          ]
        }
      ],
      "addons": [
        {
          "id": "github-setup",
          "sourceId": "github-setup",
          "sourceOrder": 0,
          "name": "GitHub Setup",
          "description": "Automate GitHub workflows with Actions, Dependabot, and templates for issues and pull requests.",
          "sourceUrl": "https://github.com/Create-Node-App/cna-templates/tree/main/extensions/all-github-setup",
          "category": "Tooling",
          "labels": [
            "GitHub",
            "Automation",
            "Actions",
            "Dependabot",
            "Templates",
            "CI/CD"
          ],
          "typeIds": [
            "react",
            "webextension-react",
            "monorepo",
            "nestjs-backend",
            "nextjs",
            "nextjs-saas-ai"
          ],
          "declaredCompatibleTemplateIds": [],
          "compatibleTemplateIds": [
            "nestjs-boilerplate",
            "nextjs-starter",
            "turborepo-boilerplate",
            "react-vite-boilerplate",
            "web-extension-react-boilerplate",
            "nextjs-saas-ai-starter"
          ],
          "incompatibleTemplateIds": [
            "webdriverio-boilerplate",
            "remix-starter",
            "astro-starter",
            "hono-starter"
          ],
          "declaredIncompatibleAddonIds": [],
          "incompatibleAddonIds": []
        },
        {
          "id": "github-setup-uat",
          "sourceId": "github-setup-uat",
          "sourceOrder": 1,
          "name": "GitHub Setup for User Acceptance Testing",
          "description": "This extension adds GitHub setup to your project including GitHub Actions, Dependabot, Issue Templates, Pull Request Templates, and more. It also adds a GitHub Action to run User Acceptance Tests using Selenium.",